{"checks":[{"id":"OBSERVED_SOURCE_TREE_CLEAN","result":"PASS"},{"id":"OBSERVED_ARTIFACT_HASHES","result":"PASS"},{"id":"DEBIAN_13_AMD64_X86_64_SYSTEMD_257_VM","result":"PASS"},{"id":"INITIAL_INVOCATION_BOUND","result":"PASS"},{"id":"INITIAL_ARGUMENTLESS_PRODUCTION_BOUNDARY","result":"PASS"},{"id":"SINGLETON_WORKER_KERNEL_CLEANUP_CONFIRMED","result":"PASS"},{"id":"SINGLETON_CLEANUP_CONFIRMED_EXACT_CUSTODY","result":"PASS"},{"id":"FORCED_HELPER_SIGKILL_OBSERVED","result":"PASS"},{"id":"SYSTEMD_FDSTORE_EXACT_CUSTODY_PRESERVED_AFTER_CRASH","result":"PASS"},{"id":"RESTART_DISTINCT_ARGUMENTLESS_INVOCATION_BOUND","result":"PASS"},{"id":"RESTART_INHERITED_SINGLETON_EXACT_PRESENT","result":"PASS"},{"id":"RESTART_SOCKET_UNPUBLISHED_BEFORE_SETTLEMENT","result":"PASS"},{"id":"RESTART_STARTUP_REMOVAL_CALL_OBSERVED","result":"PASS"},{"id":"RESTART_FDSTORE_ZERO_AFTER_STABLE_EMPTY_OBSERVATION","result":"PASS"},{"id":"RESTART_JOURNAL_ABSENT_RECOVERED_MAY_OWN","result":"PASS"},{"id":"RESTART_SOCKET_PUBLISHED_AFTER_SETTLEMENT","result":"PASS"},{"id":"RESTART_RETIRED_UNIT_NOT_FOUND","result":"PASS"},{"id":"RETIREMENT_LOCK_RELEASED","result":"PASS"},{"id":"RETIREMENT_SOCKET_ABSENT","result":"PASS"},{"id":"ENUMERATED_HOST_STATE_EQUAL_AT_FENCES","result":"PASS"}],"enumerated_host_state":{"after_sha256":"1111111111111111111111111111111111111111111111111111111111111111","before_sha256":"1111111111111111111111111111111111111111111111111111111111111111","equal_at_fences":true,"records":["production_runtime_path","accounts","namespaces","mounts","resolver","sysctls","links","addresses","routes","rules","nexthops","qdiscs","nftables","wireguard","legacy_ipv4_firewall","legacy_ipv6_firewall"]},"environment":{"debian_version":"13","dpkg_architecture":"amd64","kernel_release":"6.12.43+deb13-amd64","machine":"x86_64","systemd_version":257,"virtualization":"vm"},"finished_at":"2026-08-30T12:00:05Z","generated_at":"2026-08-30T12:00:06Z","invocation_ids":["11111111111111111111111111111111","22222222222222222222222222222222"],"observed_artifact_hashes":{"debugger_sha256":"5555555555555555555555555555555555555555555555555555555555555555","production_ipc_probe_sha256":"2222222222222222222222222222222222222222222222222222222222222222","production_ipc_unit_hook_sha256":"3333333333333333333333333333333333333333333333333333333333333333","restart_launcher_sha256":"6666666666666666666666666666666666666666666666666666666666666666","restart_observer_sha256":"4444444444444444444444444444444444444444444444444444444444444444","volparossa_helper_sha256":"1111111111111111111111111111111111111111111111111111111111111111"},"observed_source":{"commit_sha":"1111111111111111111111111111111111111111","worktree_clean":true},"overall":"PASS","report_kind":"volparossa-helper-restart-exact-present-evidence","restart":{"crash":{"crashed_at":"2026-08-30T12:00:02Z","exec_main_code":"killed","exec_main_status":9,"failed_unit_retained":true,"fdstore_after_crash":2,"fdstore_exact_identity_preserved":true,"signal":"SIGKILL","unit_result":"signal"},"initial":{"argumentless":true,"cleanup_confirmed_at":"2026-08-30T12:00:01Z","fdstore_before_crash":2,"fdstore_exact_identity_bound":true,"journal_phase_before_crash":"CleanupConfirmed","target_count":1,"target_role":"Client","worker_kernel_cleanup_confirmed":true},"resumed":{"argumentless":true,"inherited_descriptor_count":2,"journal_absent_origin":"RecoveredMayOwn","journal_phase_after_settlement":"Absent","journal_stable_read_count":2,"journal_temporary_entry_absent":true,"manager_fdstore_after_removal":0,"manager_fdstore_before_removal":2,"new_socket_published_after_settlement":true,"new_socket_published_before_settlement":false,"restarted_at":"2026-08-30T12:00:03Z","settled_at":"2026-08-30T12:00:04Z","startup_removal_call":"systemd_fdstore::remove_restart_custody","target_count":1,"target_disposition":"ExactPresent","target_phase":"CleanupConfirmed","unit_load_state_after_retirement":"not-found"}},"retirement":{"journal_settled_absent":true,"lock_released":true,"socket_absent":true},"schema_version":1,"scope":{"acceptance_a01_a15":false,"cleanup_confirmed_exact_present_singleton":true,"cleanup_confirmed_mixed_restart":false,"cleanup_owned":false,"datapath":false,"forced_helper_crash":true,"helper_boundary_only":true,"installed_package":false,"may_own_recovery":false,"restart_recovery":false},"started_at":"2026-08-30T12:00:00Z"}
